{
  "schemaVersion": "1.0",
  "id": "ch_01JZ7P9QK2R6D4W8K3A1B5C9D0",
  "type": "chapter",
  "title": "第一章",
  "order": 1,
  "status": "draft",
  "volumeId": "vol_01",
  "povCharacterIds": ["chr_hero"],
  "locationIds": ["loc_capital"],
  "timelineEventIds": ["evt_arrival"],
  "tags": ["opening"],
  "wordCount": 3200,
  "createdAt": "2026-07-03T00:00:00.000Z",
  "updatedAt": "2026-07-03T00:00:00.000Z"
}
